"No.","Time","Source","Destination","Protocol","Length","Info"
"1","0.000000","fe80::a47a:1571:8431:9438","ff02::1:2","DHCPv6","157","Solicit XID: 0x200273 CID: 00010001280eccaf74d83e337070 "
"2","1.008329","fe80::a47a:1571:8431:9438","ff02::1:2","DHCPv6","157","Solicit XID: 0x200273 CID: 00010001280eccaf74d83e337070 "
"3","5.024674","fe80::a47a:1571:8431:9438","ff02::1:2","DHCPv6","157","Solicit XID: 0x200273 CID: 00010001280eccaf74d83e337070 "
"4","21.107487","fe80::a47a:1571:8431:9438","ff02::1:2","DHCPv6","157","Solicit XID: 0x05157f CID: 00010001280eccaf74d83e337070 "
"5","22.105882","fe80::a47a:1571:8431:9438","ff02::1:2","DHCPv6","157","Solicit XID: 0x05157f CID: 00010001280eccaf74d83e337070 "
"6","26.127437","fe80::a47a:1571:8431:9438","ff02::1:2","DHCPv6","157","Solicit XID: 0x05157f CID: 00010001280eccaf74d83e337070 "
"7","27.387909","VMware_5b:d9:fb","Broadcast","ARP","42","Who has 192.168.33.251? Tell 192.168.33.100"
"8","27.391239","06:75:f1:6d:6a:cd","VMware_5b:d9:fb","ARP","60","192.168.33.251 is at 06:75:f1:6d:6a:cd"
"9","27.391258","192.168.33.100","192.168.33.251","DNS","88","Standard query 0x9e40 A contile.services.mozilla.com"
"10","27.402271","192.168.33.100","192.168.33.251","DNS","88","Standard query 0x9545 AAAA contile.services.mozilla.com"
"11","27.461933","192.168.33.251","192.168.33.100","DNS","104","Standard query response 0x9e40 A contile.services.mozilla.com A 34.117.237.239"
"12","27.468646","192.168.33.251","192.168.33.100","DNS","169","Standard query response 0x9545 AAAA contile.services.mozilla.com SOA ns-679.awsdns-20.net"
"13","27.470781","192.168.33.100","34.117.237.239","TCP","74","37488  >  443 [SYN] Seq=0 Win=64240 Len=0 MSS=1460 SACK_PERM TSval=1366050052 TSecr=0 WS=128"
"14","27.529244","34.117.237.239","192.168.33.100","TCP","74","443  >  37488 [SYN, ACK] Seq=0 Ack=1 Win=65535 Len=0 MSS=1318 SACK_PERM TSval=595579921 TSecr=1366050052 WS=256"
"15","27.529304","192.168.33.100","34.117.237.239","TCP","66","37488  >  443 [ACK] Seq=1 Ack=1 Win=64256 Len=0 TSval=1366050111 TSecr=595579921"
"16","27.547379","192.168.33.100","34.117.237.239","TLSv1.3","583","Client Hello (SNI=contile.services.mozilla.com)"
"17","27.610359","34.117.237.239","192.168.33.100","TCP","66","443  >  37488 [ACK] Seq=1 Ack=518 Win=66816 Len=0 TSval=595580011 TSecr=1366050129"
"18","27.622036","34.117.237.239","192.168.33.100","TLSv1.3","1372","Server Hello, Change Cipher Spec"
"19","27.622069","192.168.33.100","34.117.237.239","TCP","66","37488  >  443 [ACK] Seq=518 Ack=1307 Win=64128 Len=0 TSval=1366050204 TSecr=595580013"
"20","27.622488","34.117.237.239","192.168.33.100","TCP","1372","443  >  37488 [PSH, ACK] Seq=1307 Ack=518 Win=66816 Len=1306 TSval=595580013 TSecr=1366050129 [TCP segment of a reassembled PDU]"
"21","27.622501","192.168.33.100","34.117.237.239","TCP","66","37488  >  443 [ACK] Seq=518 Ack=2613 Win=63488 Len=0 TSval=1366050204 TSecr=595580013"
"22","27.629175","34.117.237.239","192.168.33.100","TLSv1.3","1969","Application Data"
"23","27.629309","192.168.33.100","34.117.237.239","TCP","66","37488  >  443 [ACK] Seq=518 Ack=4516 Win=63488 Len=0 TSval=1366050211 TSecr=595580013"
"24","28.240430","192.168.33.100","192.168.33.251","DNS","74","Standard query 0x2fdd A r3.o.lencr.org"
"25","28.240665","192.168.33.100","192.168.33.251","DNS","74","Standard query 0xfdd2 AAAA r3.o.lencr.org"
"26","28.349201","192.168.33.251","192.168.33.100","DNS","197","Standard query response 0xfdd2 AAAA r3.o.lencr.org CNAME o.lencr.edgesuite.net CNAME a1887.dscq.akamai.net AAAA 2600:140f:3c00::b81c:ad10 AAAA 2600:140f:3c00::b81c:ad0a"
"27","28.354822","192.168.33.251","192.168.33.100","DNS","173","Standard query response 0x2fdd A r3.o.lencr.org CNAME o.lencr.edgesuite.net CNAME a1887.dscq.akamai.net A 23.212.50.234 A 23.212.50.219"
"28","28.356610","2401:4900:4ffc:acba:323:b89d:2394:b9f7","2600:140f:3c00::b81c:ad10","TCP","94","38748  >  80 [SYN] Seq=0 Win=64900 Len=0 MSS=1298 SACK_PERM TSval=132883556 TSecr=0 WS=128"
"29","28.393553","fe80::475:f1ff:fe6d:6acd","ff02::1:ff94:b9f7","ICMPv6","86","Neighbor Solicitation for 2401:4900:4ffc:acba:323:b89d:2394:b9f7 from 06:75:f1:6d:6a:cd"
"30","28.393641","2401:4900:4ffc:acba:323:b89d:2394:b9f7","fe80::475:f1ff:fe6d:6acd","ICMPv6","86","Neighbor Advertisement 2401:4900:4ffc:acba:323:b89d:2394:b9f7 (sol, ovr) is at 00:0c:29:5b:d9:fb"
"31","28.396392","2600:140f:3c00::b81c:ad10","2401:4900:4ffc:acba:323:b89d:2394:b9f7","TCP","94","80  >  38748 [SYN, ACK] Seq=0 Ack=1 Win=64260 Len=0 MSS=1298 SACK_PERM TSval=850680350 TSecr=132883556 WS=128"
"32","28.396521","2401:4900:4ffc:acba:323:b89d:2394:b9f7","2600:140f:3c00::b81c:ad10","TCP","86","38748  >  80 [ACK] Seq=1 Ack=1 Win=65024 Len=0 TSval=132883596 TSecr=850680350"
"33","28.396844","2401:4900:4ffc:acba:323:b89d:2394:b9f7","2600:140f:3c00::b81c:ad10","OCSP","501","Request"
"34","28.451632","2600:140f:3c00::b81c:ad10","2401:4900:4ffc:acba:323:b89d:2394:b9f7","TCP","86","80  >  38748 [ACK] Seq=1 Ack=416 Win=64128 Len=0 TSval=850680403 TSecr=132883597"
"35","28.451667","2600:140f:3c00::b81c:ad10","2401:4900:4ffc:acba:323:b89d:2394:b9f7","OCSP","974","Response"
"36","28.451696","2401:4900:4ffc:acba:323:b89d:2394:b9f7","2600:140f:3c00::b81c:ad10","TCP","86","38748  >  80 [ACK] Seq=416 Ack=889 Win=64256 Len=0 TSval=132883651 TSecr=850680405"
"37","28.469940","192.168.33.100","192.168.33.251","DNS","95","Standard query 0xa17e A content-signature-2.cdn.mozilla.net"
"38","28.470124","192.168.33.100","192.168.33.251","DNS","95","Standard query 0xb87d AAAA content-signature-2.cdn.mozilla.net"
"39","28.497060","192.168.33.100","192.168.33.251","DNS","71","Standard query 0x885e A example.org"
"40","28.497698","192.168.33.100","192.168.33.251","DNS","71","Standard query 0xca8b A example.org"
"41","28.497857","192.168.33.100","192.168.33.251","DNS","71","Standard query 0x4088 AAAA example.org"
"42","28.498128","192.168.33.100","192.168.33.251","DNS","73","Standard query 0xd87a A ipv4only.arpa"
"43","28.498228","192.168.33.100","192.168.33.251","DNS","73","Standard query 0xbf7b AAAA ipv4only.arpa"
"44","28.503296","192.168.33.100","192.168.33.251","DNS","84","Standard query 0xf5b2 A detectportal.firefox.com"
"45","28.503659","192.168.33.100","192.168.33.251","DNS","84","Standard query 0x1d44 A detectportal.firefox.com"
"46","28.503727","192.168.33.100","192.168.33.251","DNS","84","Standard query 0x0646 AAAA detectportal.firefox.com"
"47","28.526259","192.168.33.100","34.117.237.239","TLSv1.3","130","Change Cipher Spec, Application Data"
"48","28.527334","192.168.33.100","34.117.237.239","TLSv1.3","236","Application Data"
"49","28.527705","192.168.33.100","34.117.237.239","TLSv1.3","247","Application Data"
"50","28.533231","192.168.33.251","192.168.33.100","DNS","249","Standard query response 0xa17e A content-signature-2.cdn.mozilla.net CNAME content-signature-chains.prod.autograph.services.mozaws.net CNAME prod.content-signature-chains.prod.webservices.mozgcp.net A 34.160.144.191"
"51","28.542996","192.168.33.251","192.168.33.100","DNS","261","Standard query response 0xb87d AAAA content-signature-2.cdn.mozilla.net CNAME content-signature-chains.prod.autograph.services.mozaws.net CNAME prod.content-signature-chains.prod.webservices.mozgcp.net AAAA 2600:1901:0:92a9::"
"52","28.543304","192.168.33.100","192.168.33.251","DNS","95","Standard query 0x094c A content-signature-2.cdn.mozilla.net"
"53","28.543531","192.168.33.100","192.168.33.251","DNS","95","Standard query 0xc34a AAAA content-signature-2.cdn.mozilla.net"
"54","28.546296","192.168.33.251","192.168.33.100","DNS","255","Standard query response 0x094c A content-signature-2.cdn.mozilla.net CNAME content-signature-chains.prod.autograph.services.mozaws.net CNAME prod.content-signature-chains.prod.webservices.mozgcp.net A 34.160.144.191"
"55","28.548245","192.168.33.251","192.168.33.100","DNS","267","Standard query response 0xc34a AAAA content-signature-2.cdn.mozilla.net CNAME content-signature-chains.prod.autograph.services.mozaws.net CNAME prod.content-signature-chains.prod.webservices.mozgcp.net AAAA 2600:1901:0:92a9::"
"56","28.548744","192.168.33.251","192.168.33.100","DNS","87","Standard query response 0x885e A example.org A 93.184.216.34"
"57","28.548744","192.168.33.251","192.168.33.100","DNS","87","Standard query response 0xca8b A example.org A 93.184.216.34"
"58","28.548744","192.168.33.251","192.168.33.100","DNS","105","Standard query response 0xd87a A ipv4only.arpa A 192.0.0.170 A 192.0.0.171"
"59","28.549529","2401:4900:4ffc:acba:323:b89d:2394:b9f7","2600:1901:0:92a9::","TCP","94","46206  >  443 [SYN] Seq=0 Win=64900 Len=0 MSS=1298 SACK_PERM TSval=673085896 TSecr=0 WS=128"
"60","28.556252","192.168.33.251","192.168.33.100","DNS","99","Standard query response 0x4088 AAAA example.org AAAA 2606:2800:220:1:248:1893:25c8:1946"
"61","28.556426","192.168.33.251","192.168.33.100","DNS","130","Standard query response 0xbf7b AAAA ipv4only.arpa SOA sns.dns.icann.org"
"62","28.556724","192.168.33.251","192.168.33.100","DNS","195","Standard query response 0xf5b2 A detectportal.firefox.com CNAME detectportal.prod.mozaws.net CNAME prod.detectportal.prod.cloudops.mozgcp.net A 34.107.221.82"
"63","28.557032","192.168.33.100","34.107.221.82","TCP","74","45934  >  80 [SYN] Seq=0 Win=64240 Len=0 MSS=1460 SACK_PERM TSval=3691346693 TSecr=0 WS=128"
"64","28.572114","192.168.33.251","192.168.33.100","DNS","207","Standard query response 0x0646 AAAA detectportal.firefox.com CNAME detectportal.prod.mozaws.net CNAME prod.detectportal.prod.cloudops.mozgcp.net AAAA 2600:1901:0:38d7::"
"65","28.577870","34.117.237.239","192.168.33.100","TLSv1.3","652","Application Data, Application Data"
"66","28.577927","192.168.33.100","34.117.237.239","TCP","66","37488  >  443 [ACK] Seq=933 Ack=5102 Win=64128 Len=0 TSval=1366051160 TSecr=595580975"
"67","28.578721","192.168.33.100","34.117.237.239","TLSv1.3","97","Application Data"
"68","28.583595","34.117.237.239","192.168.33.100","TLSv1.3","97","Application Data"
"69","28.584108","192.168.33.251","192.168.33.100","DNS","195","Standard query response 0x1d44 A detectportal.firefox.com CNAME detectportal.prod.mozaws.net CNAME prod.detectportal.prod.cloudops.mozgcp.net A 34.107.221.82"
"70","28.584492","2401:4900:4ffc:acba:323:b89d:2394:b9f7","2600:1901:0:38d7::","TCP","94","47352  >  80 [SYN] Seq=0 Win=64900 Len=0 MSS=1298 SACK_PERM TSval=3797119545 TSecr=0 WS=128"
"71","28.589457","34.117.237.239","192.168.33.100","TCP","66","443  >  37488 [ACK] Seq=5133 Ack=933 Win=68864 Len=0 TSval=595580984 TSecr=1366051109"
"72","28.612986","34.107.221.82","192.168.33.100","TCP","74","80  >  45934 [SYN, ACK] Seq=0 Ack=1 Win=65535 Len=0 MSS=1318 SACK_PERM TSval=2142049124 TSecr=3691346693 WS=256"
"73","28.613016","2600:1901:0:92a9::","2401:4900:4ffc:acba:323:b89d:2394:b9f7","TCP","94","443  >  46206 [SYN, ACK] Seq=0 Ack=1 Win=65535 Len=0 MSS=1298 SACK_PERM TSval=2876742591 TSecr=673085896 WS=256"
"74","28.613123","192.168.33.100","34.107.221.82","TCP","66","45934  >  80 [ACK] Seq=1 Ack=1 Win=64256 Len=0 TSval=3691346749 TSecr=2142049124"
"75","28.613343","2401:4900:4ffc:acba:323:b89d:2394:b9f7","2600:1901:0:92a9::","TCP","86","46206  >  443 [ACK] Seq=1 Ack=1 Win=65024 Len=0 TSval=673085960 TSecr=2876742591"
"76","28.614492","2401:4900:4ffc:acba:323:b89d:2394:b9f7","2600:1901:0:92a9::","TLSv1.2","302","Client Hello (SNI=content-signature-2.cdn.mozilla.net)"
"77","28.615238","192.168.33.100","34.107.221.82","HTTP","361","GET /success.txt?ipv4 HTTP/1.1 "
"78","28.623842","192.168.33.100","34.117.237.239","TCP","66","37488  >  443 [ACK] Seq=964 Ack=5133 Win=64128 Len=0 TSval=1366051206 TSecr=595580978"
"79","28.650137","2600:1901:0:38d7::","2401:4900:4ffc:acba:323:b89d:2394:b9f7","TCP","94","80  >  47352 [SYN, ACK] Seq=0 Ack=1 Win=65535 Len=0 MSS=1298 SACK_PERM TSval=1928165145 TSecr=3797119545 WS=256"
"80","28.650138","34.117.237.239","192.168.33.100","TCP","66","443  >  37488 [ACK] Seq=5133 Ack=964 Win=68864 Len=0 TSval=595581041 TSecr=1366051160"
"81","28.650189","2401:4900:4ffc:acba:323:b89d:2394:b9f7","2600:1901:0:38d7::","TCP","86","47352  >  80 [ACK] Seq=1 Ack=1 Win=65024 Len=0 TSval=3797119611 TSecr=1928165145"
"82","28.650435","2401:4900:4ffc:acba:323:b89d:2394:b9f7","2600:1901:0:38d7::","HTTP","381","GET /success.txt?ipv6 HTTP/1.1 "
"83","28.691388","34.107.221.82","192.168.33.100","TCP","66","80  >  45934 [ACK] Seq=1 Ack=296 Win=66816 Len=0 TSval=2142049198 TSecr=3691346751"
"84","28.691639","2600:1901:0:92a9::","2401:4900:4ffc:acba:323:b89d:2394:b9f7","TCP","86","443  >  46206 [ACK] Seq=1 Ack=217 Win=66816 Len=0 TSval=2876742672 TSecr=673085961"
"85","28.691863","2600:1901:0:92a9::","2401:4900:4ffc:acba:323:b89d:2394:b9f7","TLSv1.2","1294","Server Hello"
"86","28.691898","2401:4900:4ffc:acba:323:b89d:2394:b9f7","2600:1901:0:92a9::","TCP","86","46206  >  443 [ACK] Seq=217 Ack=1209 Win=64256 Len=0 TSval=673086039 TSecr=2876742674"
"87","28.698419","2600:1901:0:92a9::","2401:4900:4ffc:acba:323:b89d:2394:b9f7","TCP","1294","443  >  46206 [PSH, ACK] Seq=1209 Ack=217 Win=66816 Len=1208 TSval=2876742674 TSecr=673085961 [TCP segment of a reassembled PDU]"
"88","28.698420","2600:1901:0:92a9::","2401:4900:4ffc:acba:323:b89d:2394:b9f7","TCP","1294","443  >  46206 [ACK] Seq=2417 Ack=217 Win=66816 Len=1208 TSval=2876742674 TSecr=673085961 [TCP segment of a reassembled PDU]"
"89","28.698534","2401:4900:4ffc:acba:323:b89d:2394:b9f7","2600:1901:0:92a9::","TCP","86","46206  >  443 [ACK] Seq=217 Ack=2417 Win=64256 Len=0 TSval=673086045 TSecr=2876742674"
"90","28.698670","2401:4900:4ffc:acba:323:b89d:2394:b9f7","2600:1901:0:92a9::","TCP","86","46206  >  443 [ACK] Seq=217 Ack=3625 Win=63360 Len=0 TSval=673086045 TSecr=2876742674"
"91","28.698732","34.107.221.82","192.168.33.100","HTTP","282","HTTP/1.1 200 OK  (text/plain)"
"92","28.698779","192.168.33.100","34.107.221.82","TCP","66","45934  >  80 [ACK] Seq=296 Ack=217 Win=64128 Len=0 TSval=3691346834 TSecr=2142049201"
"93","28.698860","2600:1901:0:92a9::","2401:4900:4ffc:acba:323:b89d:2394:b9f7","TLSv1.2","864","Certificate, Server Key Exchange, Server Hello Done"
"94","28.698870","2401:4900:4ffc:acba:323:b89d:2394:b9f7","2600:1901:0:92a9::","TCP","86","46206  >  443 [ACK] Seq=217 Ack=4403 Win=64256 Len=0 TSval=673086046 TSecr=2876742674"
"95","28.702564","2401:4900:4ffc:acba:323:b89d:2394:b9f7","2600:1901:0:92a9::","TLSv1.2","179","Client Key Exchange, Change Cipher Spec, Encrypted Handshake Message"
"96","28.706860","2600:1901:0:38d7::","2401:4900:4ffc:acba:323:b89d:2394:b9f7","TCP","86","80  >  47352 [ACK] Seq=1 Ack=296 Win=66816 Len=0 TSval=1928165210 TSecr=3797119611"
"97","28.712758","2600:1901:0:38d7::","2401:4900:4ffc:acba:323:b89d:2394:b9f7","HTTP","302","HTTP/1.1 200 OK  (text/plain)"
"98","28.712812","2401:4900:4ffc:acba:323:b89d:2394:b9f7","2600:1901:0:38d7::","TCP","86","47352  >  80 [ACK] Seq=296 Ack=217 Win=64896 Len=0 TSval=3797119673 TSecr=1928165211"
"99","28.714891","2401:4900:4ffc:acba:323:b89d:2394:b9f7","2600:140f:3c00::b81c:ad10","OCSP","501","Request"
"100","28.796997","2600:140f:3c00::b81c:ad10","2401:4900:4ffc:acba:323:b89d:2394:b9f7","TCP","86","80  >  38748 [ACK] Seq=889 Ack=831 Win=64128 Len=0 TSval=850680729 TSecr=132883915"
"101","28.796998","34.117.237.239","192.168.33.100","TLSv1.3","353","Application Data"
"102","28.796998","2600:1901:0:92a9::","2401:4900:4ffc:acba:323:b89d:2394:b9f7","TLSv1.2","381","New Session Ticket, Change Cipher Spec, Encrypted Handshake Message"
"103","28.797057","192.168.33.100","34.117.237.239","TCP","66","37488  >  443 [ACK] Seq=964 Ack=5420 Win=64128 Len=0 TSval=1366051379 TSecr=595581168"
"104","28.796998","2600:1901:0:92a9::","2401:4900:4ffc:acba:323:b89d:2394:b9f7","TLSv1.2","155","Application Data"
"105","28.796998","2600:140f:3c00::b81c:ad10","2401:4900:4ffc:acba:323:b89d:2394:b9f7","OCSP","974","Response"
"106","28.796998","34.117.237.239","192.168.33.100","TLSv1.3","1137","Application Data"
"107","28.797234","2401:4900:4ffc:acba:323:b89d:2394:b9f7","2600:140f:3c00::b81c:ad10","TCP","86","38748  >  80 [ACK] Seq=831 Ack=1777 Win=64256 Len=0 TSval=132883997 TSecr=850680732"
"108","28.796998","34.117.237.239","192.168.33.100","TLSv1.3","105","Application Data"
"109","28.797313","192.168.33.100","34.117.237.239","TCP","66","37488  >  443 [ACK] Seq=964 Ack=6491 Win=64128 Len=0 TSval=1366051379 TSecr=595581172"
"110","28.797373","192.168.33.100","34.117.237.239","TCP","66","37488  >  443 [ACK] Seq=964 Ack=6530 Win=64128 Len=0 TSval=1366051379 TSecr=595581172"
"111","28.800886","192.168.33.100","34.117.237.239","TLSv1.3","105","Application Data"
"112","28.839892","2401:4900:4ffc:acba:323:b89d:2394:b9f7","2600:1901:0:92a9::","TCP","86","46206  >  443 [ACK] Seq=310 Ack=4767 Win=64256 Len=0 TSval=673086187 TSecr=2876742759"
"113","28.856527","34.117.237.239","192.168.33.100","TCP","66","443  >  37488 [ACK] Seq=6530 Ack=1003 Win=68864 Len=0 TSval=595581255 TSecr=1366051383"
"114","28.879711","2401:4900:4ffc:acba:323:b89d:2394:b9f7","2600:1901:0:92a9::","TLSv1.2","263","Application Data"
"115","28.880431","2401:4900:4ffc:acba:323:b89d:2394:b9f7","2600:1901:0:92a9::","TLSv1.2","327","Application Data"
"116","28.880826","2401:4900:4ffc:acba:323:b89d:2394:b9f7","2600:1901:0:92a9::","TLSv1.2","124","Application Data"
"117","28.938700","2600:1901:0:92a9::","2401:4900:4ffc:acba:323:b89d:2394:b9f7","TLSv1.2","124","Application Data"
"118","28.938759","2401:4900:4ffc:acba:323:b89d:2394:b9f7","2600:1901:0:92a9::","TCP","86","46206  >  443 [ACK] Seq=766 Ack=4805 Win=64256 Len=0 TSval=673086285 TSecr=2876742925"
"119","28.944848","2600:1901:0:92a9::","2401:4900:4ffc:acba:323:b89d:2394:b9f7","TCP","86","443  >  46206 [ACK] Seq=4805 Ack=766 Win=68864 Len=0 TSval=2876742926 TSecr=673086227"
"120","28.945264","2600:1901:0:92a9::","2401:4900:4ffc:acba:323:b89d:2394:b9f7","TLSv1.2","419","Application Data"
"121","28.945264","2600:1901:0:92a9::","2401:4900:4ffc:acba:323:b89d:2394:b9f7","TLSv1.2","1294","Application Data"
"122","28.945300","2401:4900:4ffc:acba:323:b89d:2394:b9f7","2600:1901:0:92a9::","TCP","86","46206  >  443 [ACK] Seq=766 Ack=5138 Win=64256 Len=0 TSval=673086292 TSecr=2876742927"
"123","28.945427","2401:4900:4ffc:acba:323:b89d:2394:b9f7","2600:1901:0:92a9::","TCP","86","46206  >  443 [ACK] Seq=766 Ack=6346 Win=63104 Len=0 TSval=673086292 TSecr=2876742927"
"124","28.945910","2600:1901:0:92a9::","2401:4900:4ffc:acba:323:b89d:2394:b9f7","TLSv1.2","1294","Application Data"
"125","28.945910","2600:1901:0:92a9::","2401:4900:4ffc:acba:323:b89d:2394:b9f7","TLSv1.2","1294","Application Data"
"126","28.945925","2401:4900:4ffc:acba:323:b89d:2394:b9f7","2600:1901:0:92a9::","TCP","86","46206  >  443 [ACK] Seq=766 Ack=7554 Win=62592 Len=0 TSval=673086293 TSecr=2876742927"
"127","28.946009","2401:4900:4ffc:acba:323:b89d:2394:b9f7","2600:1901:0:92a9::","TCP","86","46206  >  443 [ACK] Seq=766 Ack=8762 Win=61568 Len=0 TSval=673086293 TSecr=2876742929"
"128","28.950567","2600:1901:0:92a9::","2401:4900:4ffc:acba:323:b89d:2394:b9f7","TLSv1.2","1294","Application Data"
"129","28.950568","2600:1901:0:92a9::","2401:4900:4ffc:acba:323:b89d:2394:b9f7","TLSv1.2","756","Application Data"
"130","28.950623","2401:4900:4ffc:acba:323:b89d:2394:b9f7","2600:1901:0:92a9::","TCP","86","46206  >  443 [ACK] Seq=766 Ack=9970 Win=64256 Len=0 TSval=673086297 TSecr=2876742929"
"131","28.950740","2401:4900:4ffc:acba:323:b89d:2394:b9f7","2600:1901:0:92a9::","TCP","86","46206  >  443 [ACK] Seq=766 Ack=10640 Win=63616 Len=0 TSval=673086297 TSecr=2876742933"
"132","28.950791","2600:1901:0:92a9::","2401:4900:4ffc:acba:323:b89d:2394:b9f7","TLSv1.2","132","Application Data"
"133","28.950897","2401:4900:4ffc:acba:323:b89d:2394:b9f7","2600:1901:0:92a9::","TCP","86","46206  >  443 [ACK] Seq=766 Ack=10686 Win=64256 Len=0 TSval=673086298 TSecr=2876742934"
"134","28.950998","2401:4900:4ffc:acba:323:b89d:2394:b9f7","2600:1901:0:92a9::","TLSv1.2","132","Application Data"
"135","29.010197","2600:1901:0:92a9::","2401:4900:4ffc:acba:323:b89d:2394:b9f7","TCP","86","443  >  46206 [ACK] Seq=10686 Ack=812 Win=68864 Len=0 TSval=2876742997 TSecr=673086298"
"136","29.507149","192.168.33.100","192.168.33.251","DNS","87","Standard query 0x9013 A safebrowsing.googleapis.com"
"137","29.507364","192.168.33.100","192.168.33.251","DNS","87","Standard query 0xa81c AAAA safebrowsing.googleapis.com"
"138","29.580823","192.168.33.251","192.168.33.100","DNS","103","Standard query response 0x9013 A safebrowsing.googleapis.com A 142.250.77.106"
"139","29.585961","192.168.33.251","192.168.33.100","DNS","115","Standard query response 0xa81c AAAA safebrowsing.googleapis.com AAAA 2404:6800:4007:81a::200a"
"140","29.586459","2401:4900:4ffc:acba:323:b89d:2394:b9f7","2404:6800:4007:81a::200a","TCP","94","43840  >  443 [SYN] Seq=0 Win=64900 Len=0 MSS=1298 SACK_PERM TSval=2181464617 TSecr=0 WS=128"
"141","29.659948","2404:6800:4007:81a::200a","2401:4900:4ffc:acba:323:b89d:2394:b9f7","TCP","94","443  >  43840 [SYN, ACK] Seq=0 Ack=1 Win=65535 Len=0 MSS=1298 SACK_PERM TSval=2979740604 TSecr=2181464617 WS=256"
"142","29.660012","2401:4900:4ffc:acba:323:b89d:2394:b9f7","2404:6800:4007:81a::200a","TCP","86","43840  >  443 [ACK] Seq=1 Ack=1 Win=65024 Len=0 TSval=2181464691 TSecr=2979740604"
"143","29.662712","2401:4900:4ffc:acba:323:b89d:2394:b9f7","2404:6800:4007:81a::200a","TLSv1.3","603","Client Hello (SNI=safebrowsing.googleapis.com)"
"144","29.732176","2404:6800:4007:81a::200a","2401:4900:4ffc:acba:323:b89d:2394:b9f7","TCP","86","443  >  43840 [ACK] Seq=1 Ack=518 Win=66816 Len=0 TSval=2979740670 TSecr=2181464693"
"145","29.758299","2404:6800:4007:81a::200a","2401:4900:4ffc:acba:323:b89d:2394:b9f7","TLSv1.3","1294","Server Hello, Change Cipher Spec"
"146","29.758337","2401:4900:4ffc:acba:323:b89d:2394:b9f7","2404:6800:4007:81a::200a","TCP","86","43840  >  443 [ACK] Seq=518 Ack=1209 Win=64256 Len=0 TSval=2181464789 TSecr=2979740702"
"147","29.764580","2404:6800:4007:81a::200a","2401:4900:4ffc:acba:323:b89d:2394:b9f7","TCP","1294","443  >  43840 [PSH, ACK] Seq=1209 Ack=518 Win=66816 Len=1208 TSval=2979740702 TSecr=2181464693 [TCP segment of a reassembled PDU]"
"148","29.764617","2401:4900:4ffc:acba:323:b89d:2394:b9f7","2404:6800:4007:81a::200a","TCP","86","43840  >  443 [ACK] Seq=518 Ack=2417 Win=64256 Len=0 TSval=2181464795 TSecr=2979740702"
"149","29.764811","2404:6800:4007:81a::200a","2401:4900:4ffc:acba:323:b89d:2394:b9f7","TCP","1294","443  >  43840 [ACK] Seq=2417 Ack=518 Win=66816 Len=1208 TSval=2979740702 TSecr=2181464693 [TCP segment of a reassembled PDU]"
"150","29.764824","2401:4900:4ffc:acba:323:b89d:2394:b9f7","2404:6800:4007:81a::200a","TCP","86","43840  >  443 [ACK] Seq=518 Ack=3625 Win=63488 Len=0 TSval=2181464796 TSecr=2979740702"
"151","29.764908","2404:6800:4007:81a::200a","2401:4900:4ffc:acba:323:b89d:2394:b9f7","TLSv1.3","1143","Application Data"
"152","29.764914","2401:4900:4ffc:acba:323:b89d:2394:b9f7","2404:6800:4007:81a::200a","TCP","86","43840  >  443 [ACK] Seq=518 Ack=4682 Win=62592 Len=0 TSval=2181464796 TSecr=2979740702"
"153","29.777407","192.168.33.100","192.168.33.251","DNS","73","Standard query 0x2e09 A ocsp.pki.goog"
"154","29.777802","192.168.33.100","192.168.33.251","DNS","73","Standard query 0x0c0e AAAA ocsp.pki.goog"
"155","29.826432","192.168.33.251","192.168.33.100","DNS","124","Standard query response 0x2e09 A ocsp.pki.goog CNAME pki-goog.l.google.com A 142.250.196.163"
"156","29.832820","192.168.33.251","192.168.33.100","DNS","136","Standard query response 0x0c0e AAAA ocsp.pki.goog CNAME pki-goog.l.google.com AAAA 2404:6800:4007:825::2003"
"157","29.836149","2401:4900:4ffc:acba:323:b89d:2394:b9f7","2404:6800:4007:825::2003","TCP","94","59318  >  80 [SYN] Seq=0 Win=64900 Len=0 MSS=1298 SACK_PERM TSval=3882954734 TSecr=0 WS=128"
"158","29.892870","2404:6800:4007:825::2003","2401:4900:4ffc:acba:323:b89d:2394:b9f7","TCP","94","80  >  59318 [SYN, ACK] Seq=0 Ack=1 Win=65535 Len=0 MSS=1298 SACK_PERM TSval=1267030638 TSecr=3882954734 WS=256"
"159","29.892916","2401:4900:4ffc:acba:323:b89d:2394:b9f7","2404:6800:4007:825::2003","TCP","86","59318  >  80 [ACK] Seq=1 Ack=1 Win=65024 Len=0 TSval=3882954791 TSecr=1267030638"
"160","29.895178","2401:4900:4ffc:acba:323:b89d:2394:b9f7","2404:6800:4007:825::2003","OCSP","505","Request"
"161","29.941054","192.168.33.100","192.168.33.251","DNS","85","Standard query 0xcc1f A push.services.mozilla.com"
"162","29.941256","192.168.33.100","192.168.33.251","DNS","85","Standard query 0x261c AAAA push.services.mozilla.com"
"163","29.972956","2404:6800:4007:825::2003","2401:4900:4ffc:acba:323:b89d:2394:b9f7","TCP","86","80  >  59318 [ACK] Seq=1 Ack=420 Win=66816 Len=0 TSval=1267030720 TSecr=3882954793"
"164","29.989925","192.168.33.251","192.168.33.100","DNS","139","Standard query response 0xcc1f A push.services.mozilla.com CNAME autopush.prod.mozaws.net A 34.107.243.93"
"165","30.012353","2404:6800:4007:825::2003","2401:4900:4ffc:acba:323:b89d:2394:b9f7","OCSP","788","Response"
"166","30.012459","2401:4900:4ffc:acba:323:b89d:2394:b9f7","2404:6800:4007:825::2003","TCP","86","59318  >  80 [ACK] Seq=420 Ack=703 Win=64384 Len=0 TSval=3882954910 TSecr=1267030753"
"167","30.019574","192.168.33.251","192.168.33.100","DNS","205","Standard query response 0x261c AAAA push.services.mozilla.com CNAME autopush.prod.mozaws.net SOA ns-1260.awsdns-29.org"
"168","30.025320","2401:4900:4ffc:acba:323:b89d:2394:b9f7","2404:6800:4007:81a::200a","TLSv1.3","150","Change Cipher Spec, Application Data"
"169","30.025940","192.168.33.100","192.168.33.251","DNS","85","Standard query 0x065d A push.services.mozilla.com"
"170","30.026061","2401:4900:4ffc:acba:323:b89d:2394:b9f7","2404:6800:4007:81a::200a","TLSv1.3","256","Application Data"
"171","30.026063","2401:4900:4ffc:acba:323:b89d:2394:b9f7","2404:6800:4007:81a::200a","TLSv1.3","697","Application Data"
"172","30.026597","192.168.33.100","192.168.33.251","DNS","85","Standard query 0x86a3 AAAA push.services.mozilla.com"
"173","30.028713","192.168.33.251","192.168.33.100","DNS","139","Standard query response 0x065d A push.services.mozilla.com CNAME autopush.prod.mozaws.net A 34.107.243.93"
"174","30.029117","192.168.33.251","192.168.33.100","DNS","123","Standard query response 0x86a3 AAAA push.services.mozilla.com CNAME autopush.prod.mozaws.net"
"175","30.029502","192.168.33.100","34.107.243.93","TCP","74","57476  >  443 [SYN] Seq=0 Win=64240 Len=0 MSS=1460 SACK_PERM TSval=3985916523 TSecr=0 WS=128"
"176","30.071306","192.168.33.100","192.168.33.251","DNS","97","Standard query 0x2e6c A firefox.settings.services.mozilla.com"
"177","30.071867","192.168.33.100","192.168.33.251","DNS","97","Standard query 0xf414 AAAA firefox.settings.services.mozilla.com"
"178","30.094476","34.107.243.93","192.168.33.100","TCP","74","443  >  57476 [SYN, ACK] Seq=0 Ack=1 Win=65535 Len=0 MSS=1318 SACK_PERM TSval=1760641267 TSecr=3985916523 WS=256"
"179","30.094539","192.168.33.100","34.107.243.93","TCP","66","57476  >  443 [ACK] Seq=1 Ack=1 Win=64256 Len=0 TSval=3985916588 TSecr=1760641267"
"180","30.097038","192.168.33.100","34.107.243.93","TLSv1.3","583","Client Hello (SNI=push.services.mozilla.com)"
"181","30.101411","2404:6800:4007:81a::200a","2401:4900:4ffc:acba:323:b89d:2394:b9f7","TLSv1.3","700","Application Data, Application Data"
"182","30.101412","2404:6800:4007:81a::200a","2401:4900:4ffc:acba:323:b89d:2394:b9f7","TLSv1.3","117","Application Data"
"183","30.101412","2404:6800:4007:81a::200a","2401:4900:4ffc:acba:323:b89d:2394:b9f7","TCP","86","443  >  43840 [ACK] Seq=5327 Ack=1363 Win=69120 Len=0 TSval=2979741043 TSecr=2181465057"
"184","30.101510","2401:4900:4ffc:acba:323:b89d:2394:b9f7","2404:6800:4007:81a::200a","TCP","86","43840  >  443 [ACK] Seq=1363 Ack=5296 Win=64256 Len=0 TSval=2181465132 TSecr=2979741036"
"185","30.101831","2401:4900:4ffc:acba:323:b89d:2394:b9f7","2404:6800:4007:81a::200a","TCP","86","43840  >  443 [ACK] Seq=1363 Ack=5327 Win=64256 Len=0 TSval=2181465133 TSecr=2979741036"
"186","30.105159","2401:4900:4ffc:acba:323:b89d:2394:b9f7","2404:6800:4007:81a::200a","TLSv1.3","117","Application Data"
"187","30.132612","192.168.33.251","192.168.33.100","DNS","175","Standard query response 0x2e6c A firefox.settings.services.mozilla.com CNAME prod.remote-settings.prod.webservices.mozgcp.net A 34.149.100.209"
"188","30.157107","2404:6800:4007:81a::200a","2401:4900:4ffc:acba:323:b89d:2394:b9f7","TLSv1.3","322","Application Data"
"189","30.157107","2404:6800:4007:81a::200a","2401:4900:4ffc:acba:323:b89d:2394:b9f7","TLSv1.3","1294","Application Data"
"190","30.157155","2401:4900:4ffc:acba:323:b89d:2394:b9f7","2404:6800:4007:81a::200a","TCP","86","43840  >  443 [ACK] Seq=1394 Ack=6771 Win=64256 Len=0 TSval=2181465188 TSecr=2979741097"
"191","30.157292","2404:6800:4007:81a::200a","2401:4900:4ffc:acba:323:b89d:2394:b9f7","TLSv1.3","1294","Application Data"
"192","30.157447","2404:6800:4007:81a::200a","2401:4900:4ffc:acba:323:b89d:2394:b9f7","TLSv1.3","1294","Application Data"
"193","30.157474","2401:4900:4ffc:acba:323:b89d:2394:b9f7","2404:6800:4007:81a::200a","TCP","86","43840  >  443 [ACK] Seq=1394 Ack=9187 Win=62592 Len=0 TSval=2181465188 TSecr=2979741097"
"194","30.157704","2404:6800:4007:81a::200a","2401:4900:4ffc:acba:323:b89d:2394:b9f7","TLSv1.3","1294","Application Data"
"195","30.162974","2404:6800:4007:81a::200a","2401:4900:4ffc:acba:323:b89d:2394:b9f7","TLSv1.3","1294","Application Data"
"196","30.162997","2401:4900:4ffc:acba:323:b89d:2394:b9f7","2404:6800:4007:81a::200a","TCP","86","43840  >  443 [ACK] Seq=1394 Ack=11603 Win=64256 Len=0 TSval=2181465194 TSecr=2979741097"
"197","30.163337","2404:6800:4007:81a::200a","2401:4900:4ffc:acba:323:b89d:2394:b9f7","TLSv1.3","1294","Application Data"
"198","30.163337","2404:6800:4007:81a::200a","2401:4900:4ffc:acba:323:b89d:2394:b9f7","TLSv1.3","1294","Application Data"
"199","30.163385","2401:4900:4ffc:acba:323:b89d:2394:b9f7","2404:6800:4007:81a::200a","TCP","86","43840  >  443 [ACK] Seq=1394 Ack=14019 Win=63488 Len=0 TSval=2181465194 TSecr=2979741099"
"200","30.163532","2404:6800:4007:81a::200a","2401:4900:4ffc:acba:323:b89d:2394:b9f7","TLSv1.3","1294","Application Data"
"201","30.163769","2404:6800:4007:81a::200a","2401:4900:4ffc:acba:323:b89d:2394:b9f7","TLSv1.3","1294","Application Data"
"202","30.163781","2401:4900:4ffc:acba:323:b89d:2394:b9f7","2404:6800:4007:81a::200a","TCP","86","43840  >  443 [ACK] Seq=1394 Ack=16435 Win=64256 Len=0 TSval=2181465194 TSecr=2979741102"
"203","30.172605","2404:6800:4007:81a::200a","2401:4900:4ffc:acba:323:b89d:2394:b9f7","TLSv1.3","1294","Application Data"
"204","30.172827","2404:6800:4007:81a::200a","2401:4900:4ffc:acba:323:b89d:2394:b9f7","TLSv1.3","1294","Application Data"
"205","30.174423","2401:4900:4ffc:acba:323:b89d:2394:b9f7","2404:6800:4007:81a::200a","TCP","86","43840  >  443 [ACK] Seq=1394 Ack=18851 Win=63488 Len=0 TSval=2181465205 TSecr=2979741105"
"206","30.178833","34.107.243.93","192.168.33.100","TCP","66","443  >  57476 [ACK] Seq=1 Ack=518 Win=66816 Len=0 TSval=1760641360 TSecr=3985916591"
"207","30.178834","2404:6800:4007:81a::200a","2401:4900:4ffc:acba:323:b89d:2394:b9f7","TLSv1.3","1294","Application Data"
"208","30.178834","2404:6800:4007:81a::200a","2401:4900:4ffc:acba:323:b89d:2394:b9f7","TLSv1.3","1294","Application Data"
"209","30.178946","2401:4900:4ffc:acba:323:b89d:2394:b9f7","2404:6800:4007:81a::200a","TCP","86","43840  >  443 [ACK] Seq=1394 Ack=21267 Win=63488 Len=0 TSval=2181465210 TSecr=2979741107"
"210","30.180048","2404:6800:4007:81a::200a","2401:4900:4ffc:acba:323:b89d:2394:b9f7","TLSv1.3","1294","Application Data"
"211","30.180049","2404:6800:4007:81a::200a","2401:4900:4ffc:acba:323:b89d:2394:b9f7","TLSv1.3","2502","Application Data, Application Data"
"212","30.180049","192.168.33.251","192.168.33.100","DNS","249","Standard query response 0xf414 AAAA firefox.settings.services.mozilla.com CNAME prod.remote-settings.prod.webservices.mozgcp.net SOA ns-cloud-a1.googledomains.com"
"213","30.180049","2404:6800:4007:81a::200a","2401:4900:4ffc:acba:323:b89d:2394:b9f7","TLSv1.3","1294","Application Data"
"214","30.180222","2404:6800:4007:81a::200a","2401:4900:4ffc:acba:323:b89d:2394:b9f7","TLSv1.3","1294","Application Data"
"215","30.180222","2404:6800:4007:81a::200a","2401:4900:4ffc:acba:323:b89d:2394:b9f7","TLSv1.3","2502","Application Data, Application Data"
"216","30.180290","2401:4900:4ffc:acba:323:b89d:2394:b9f7","2404:6800:4007:81a::200a","TCP","86","43840  >  443 [ACK] Seq=1394 Ack=29723 Win=64256 Len=0 TSval=2181465211 TSecr=2979741110"
"217","30.180523","2404:6800:4007:81a::200a","2401:4900:4ffc:acba:323:b89d:2394:b9f7","TLSv1.3","1294","Application Data"
"218","30.180523","2404:6800:4007:81a::200a","2401:4900:4ffc:acba:323:b89d:2394:b9f7","TCP","86","443  >  43840 [ACK] Seq=30931 Ack=1394 Win=69120 Len=0 TSval=2979741121 TSecr=2181465136"
"219","30.183394","192.168.33.100","34.149.100.209","TCP","74","47586  >  443 [SYN] Seq=0 Win=64240 Len=0 MSS=1460 SACK_PERM TSval=3698499763 TSecr=0 WS=128"
"220","30.185494","34.107.243.93","192.168.33.100","TLSv1.3","1372","Server Hello, Change Cipher Spec"
"221","30.185535","192.168.33.100","34.107.243.93","TCP","66","57476  >  443 [ACK] Seq=518 Ack=1307 Win=64128 Len=0 TSval=3985916679 TSecr=1760641362"
"222","30.185798","34.107.243.93","192.168.33.100","TCP","1372","443  >  57476 [PSH, ACK] Seq=1307 Ack=518 Win=66816 Len=1306 TSval=1760641362 TSecr=3985916591 [TCP segment of a reassembled PDU]"
"223","30.185798","34.107.243.93","192.168.33.100","TLSv1.3","531","Application Data"
"224","30.185815","192.168.33.100","34.107.243.93","TCP","66","57476  >  443 [ACK] Seq=518 Ack=2613 Win=63488 Len=0 TSval=3985916680 TSecr=1760641362"
"225","30.185878","192.168.33.100","34.107.243.93","TCP","66","57476  >  443 [ACK] Seq=518 Ack=3078 Win=63104 Len=0 TSval=3985916680 TSecr=1760641362"
"226","30.224339","2404:6800:4007:81a::200a","2401:4900:4ffc:acba:323:b89d:2394:b9f7","TLSv1.3","1294","Application Data"
"227","30.224366","2401:4900:4ffc:acba:323:b89d:2394:b9f7","2404:6800:4007:81a::200a","TCP","86","43840  >  443 [ACK] Seq=1394 Ack=32139 Win=69504 Len=0 TSval=2181465255 TSecr=2979741120"
"228","30.224493","2404:6800:4007:81a::200a","2401:4900:4ffc:acba:323:b89d:2394:b9f7","TLSv1.3","1294","Application Data"
"229","30.230869","2404:6800:4007:81a::200a","2401:4900:4ffc:acba:323:b89d:2394:b9f7","TLSv1.3","2502","Application Data, Application Data"
"230","30.230870","2404:6800:4007:81a::200a","2401:4900:4ffc:acba:323:b89d:2394:b9f7","TLSv1.3","2502","Application Data, Application Data"
"231","30.230870","2404:6800:4007:81a::200a","2401:4900:4ffc:acba:323:b89d:2394:b9f7","TLSv1.3","1294","Application Data"
"232","30.230932","2401:4900:4ffc:acba:323:b89d:2394:b9f7","2404:6800:4007:81a::200a","TCP","86","43840  >  443 [ACK] Seq=1394 Ack=35763 Win=76800 Len=0 TSval=2181465262 TSecr=2979741148"
"233","30.239068","2401:4900:4ffc:acba:323:b89d:2394:b9f7","2404:6800:4007:81a::200a","TCP","86","43840  >  443 [ACK] Seq=1394 Ack=38179 Win=81664 Len=0 TSval=2181465270 TSecr=2979741152"
"234","30.239188","2404:6800:4007:81a::200a","2401:4900:4ffc:acba:323:b89d:2394:b9f7","TLSv1.3","1294","Application Data"
"235","30.239189","2404:6800:4007:81a::200a","2401:4900:4ffc:acba:323:b89d:2394:b9f7","TLSv1.3","2502","Application Data, Application Data"
"236","30.239189","2404:6800:4007:81a::200a","2401:4900:4ffc:acba:323:b89d:2394:b9f7","TLSv1.3","2502","Application Data, Application Data"
"237","30.239189","2404:6800:4007:81a::200a","2401:4900:4ffc:acba:323:b89d:2394:b9f7","TLSv1.3","2502","Application Data, Application Data"
"238","30.239189","2404:6800:4007:81a::200a","2401:4900:4ffc:acba:323:b89d:2394:b9f7","TLSv1.3","2502","Application Data, Application Data"
"239","30.239202","2401:4900:4ffc:acba:323:b89d:2394:b9f7","2404:6800:4007:81a::200a","TCP","86","43840  >  443 [ACK] Seq=1394 Ack=40595 Win=86784 Len=0 TSval=2181465270 TSecr=2979741155"
"240","30.239257","2401:4900:4ffc:acba:323:b89d:2394:b9f7","2404:6800:4007:81a::200a","TCP","86","43840  >  443 [ACK] Seq=1394 Ack=43011 Win=91648 Len=0 TSval=2181465270 TSecr=2979741157"
"241","30.239306","2401:4900:4ffc:acba:323:b89d:2394:b9f7","2404:6800:4007:81a::200a","TCP","86","43840  >  443 [ACK] Seq=1394 Ack=45427 Win=96512 Len=0 TSval=2181465270 TSecr=2979741160"
"242","30.239350","2401:4900:4ffc:acba:323:b89d:2394:b9f7","2404:6800:4007:81a::200a","TCP","86","43840  >  443 [ACK] Seq=1394 Ack=47843 Win=101376 Len=0 TSval=2181465270 TSecr=2979741163"
"243","30.239405","2401:4900:4ffc:acba:323:b89d:2394:b9f7","2404:6800:4007:81a::200a","TCP","86","43840  >  443 [ACK] Seq=1394 Ack=50259 Win=103680 Len=0 TSval=2181465270 TSecr=2979741165"
"244","30.241879","2404:6800:4007:81a::200a","2401:4900:4ffc:acba:323:b89d:2394:b9f7","TLSv1.3","1294","Application Data"
"245","30.242069","2404:6800:4007:81a::200a","2401:4900:4ffc:acba:323:b89d:2394:b9f7","TLSv1.3","1294","Application Data"
"246","30.242084","2401:4900:4ffc:acba:323:b89d:2394:b9f7","2404:6800:4007:81a::200a","TCP","86","43840  >  443 [ACK] Seq=1394 Ack=52675 Win=108800 Len=0 TSval=2181465273 TSecr=2979741168"
"247","30.254818","2404:6800:4007:81a::200a","2401:4900:4ffc:acba:323:b89d:2394:b9f7","TLSv1.3","1294","Application Data"
"248","30.254984","2404:6800:4007:81a::200a","2401:4900:4ffc:acba:323:b89d:2394:b9f7","TLSv1.3","1294","Application Data"
"249","30.255035","2401:4900:4ffc:acba:323:b89d:2394:b9f7","2404:6800:4007:81a::200a","TCP","86","43840  >  443 [ACK] Seq=1394 Ack=55091 Win=113920 Len=0 TSval=2181465286 TSecr=2979741170"
"250","30.260818","2404:6800:4007:81a::200a","2401:4900:4ffc:acba:323:b89d:2394:b9f7","TLSv1.3","1294","Application Data"
"251","30.261295","2404:6800:4007:81a::200a","2401:4900:4ffc:acba:323:b89d:2394:b9f7","TLSv1.3","2502","Application Data, Application Data"
"252","30.261296","2404:6800:4007:81a::200a","2401:4900:4ffc:acba:323:b89d:2394:b9f7","TLSv1.3","1294","Application Data"
"253","30.261539","2404:6800:4007:81a::200a","2401:4900:4ffc:acba:323:b89d:2394:b9f7","TLSv1.3","1294","Application Data"
"254","30.261539","2404:6800:4007:81a::200a","2401:4900:4ffc:acba:323:b89d:2394:b9f7","TLSv1.3","1294","Application Data"
"255","30.261814","2404:6800:4007:81a::200a","2401:4900:4ffc:acba:323:b89d:2394:b9f7","TLSv1.3","1294","Application Data"
"256","30.262918","2404:6800:4007:81a::200a","2401:4900:4ffc:acba:323:b89d:2394:b9f7","TLSv1.3","1294","Application Data"
"257","30.267984","2404:6800:4007:81a::200a","2401:4900:4ffc:acba:323:b89d:2394:b9f7","TLSv1.3","1294","Application Data"
"258","30.267985","2404:6800:4007:81a::200a","2401:4900:4ffc:acba:323:b89d:2394:b9f7","TLSv1.3","1294","Application Data"
"259","30.268250","2404:6800:4007:81a::200a","2401:4900:4ffc:acba:323:b89d:2394:b9f7","TLSv1.3","1294","Application Data"
"260","30.268251","2404:6800:4007:81a::200a","2401:4900:4ffc:acba:323:b89d:2394:b9f7","TLSv1.3","2502","Application Data, Application Data"
"261","30.268992","2404:6800:4007:81a::200a","2401:4900:4ffc:acba:323:b89d:2394:b9f7","TLSv1.3","2502","Application Data, Application Data"
"262","30.268992","2404:6800:4007:81a::200a","2401:4900:4ffc:acba:323:b89d:2394:b9f7","TLSv1.3","1294","Application Data"
"263","30.269179","2404:6800:4007:81a::200a","2401:4900:4ffc:acba:323:b89d:2394:b9f7","TLSv1.3","1294","Application Data"
"264","30.272845","2404:6800:4007:81a::200a","2401:4900:4ffc:acba:323:b89d:2394:b9f7","TLSv1.3","2502","Application Data, Application Data"
"265","30.272845","2404:6800:4007:81a::200a","2401:4900:4ffc:acba:323:b89d:2394:b9f7","TLSv1.3","1294","Application Data"
"266","30.273134","2404:6800:4007:81a::200a","2401:4900:4ffc:acba:323:b89d:2394:b9f7","TLSv1.3","1294","Application Data"
"267","30.273336","2404:6800:4007:81a::200a","2401:4900:4ffc:acba:323:b89d:2394:b9f7","TLSv1.3","1294","Application Data"
"268","30.273420","2401:4900:4ffc:acba:323:b89d:2394:b9f7","2404:6800:4007:81a::200a","TCP","86","43840  >  443 [ACK] Seq=1394 Ack=81667 Win=114304 Len=0 TSval=2181465304 TSecr=2979741172"
